<?xml version="1.0" encoding="UTF-8"?>
<!DOCTYPE element SYSTEM "elements.dtd">
<element series="rare-earth-metal">
   <name>Curium</name>
   <symbol>Cm</symbol>
   <atomic-number>96</atomic-number>
   <mass-number>247</mass-number>
   <electronegativity>1.3</electronegativity>
   <melting-point>1340</melting-point>
   <density>13.51</density>
   <thermal-conductivity>0.1</thermal-conductivity>
</element>
