<?xml version="1.0" encoding="UTF-8"?>
<!DOCTYPE element SYSTEM "elements.dtd">
<element series="metal">
   <name>Lead</name>
   <symbol>Pb</symbol>
   <atomic-number>82</atomic-number>
   <mass-number>207</mass-number>
   <electronegativity>2.33</electronegativity>
   <covalent-radius>1.54</covalent-radius>
   <atomic-radius>1.81</atomic-radius>
   <melting-point>600.6</melting-point>
   <boiling-point>2023.0</boiling-point>
   <density>11.34</density>
   <specific-heat>0.13</specific-heat>
   <electrical-conductivity>0.0481e6</electrical-conductivity>
   <thermal-conductivity>0.353</thermal-conductivity>
   <isotopes>
      <isotope><mass-number>204</mass-number><abundance>1.4</abundance></isotope>
      <isotope><mass-number>206</mass-number><abundance>24.1</abundance></isotope>
      <isotope><mass-number>207</mass-number><abundance>22.1</abundance></isotope>
      <isotope><mass-number>208</mass-number><abundance>52.4</abundance></isotope>
   </isotopes>
</element>
