<?xml version="1.0" encoding="UTF-8"?>
<!DOCTYPE element SYSTEM "elements.dtd">
<element series="rare-earth-metal">
   <name>Protactinium</name>
   <symbol>Pa</symbol>
   <atomic-number>91</atomic-number>
   <mass-number>231</mass-number>
   <electronegativity>1.5</electronegativity>
   <density>15.4</density>
   <specific-heat>0.12</specific-heat>
   <electrical-conductivity>0.0529e6</electrical-conductivity>
   <thermal-conductivity>0.47</thermal-conductivity>
</element>
